started_pt	commit	roundtrip_val_bpb	artifact_mb	duration_min	vocab	status	description
2026-03-19 21:36	b0a7082	2.429389	7.04	34.0	1024	keep	baseline (smoke, 65K batch, 176 steps)
2026-03-19 22:52	41511cd	2.453442	7.43	21.5	1024	discard	FP16 embeddings (bypass int8 quant for tok_emb)
2026-03-19 23:29	a87d080	2.295953	7.63	21.0	1024	keep	higher base LR (0.06/0.06/0.07)
2026-03-20 00:04	fac17d3	2.181629	8.10	21.0	1024	keep	even higher LR (0.08/0.08/0.10)
2026-03-20 00:39	ad69a37	2.060288	8.85	21.0	1024	keep	push LR higher (0.12/0.12/0.15)
2026-03-20 01:14	203314f	2.006272	9.90	21.0	1024	keep	LR 0.20/0.20/0.25
2026-03-20 01:48	98e2364	2.000873	10.72	21.0	1024	keep	LR 0.30/0.30/0.35
2026-03-20 02:23	42f91c1	1.990493	10.60	21.0	1024	keep	grad clip norm=1.0
2026-03-20 02:58	05a4fdb	2.027962	12.87	21.0	1024	discard	reduce warmdown_iters to 400
2026-03-20 03:34	4003e43	1.986876	10.47	21.0	1024	keep	Muon weight decay 0.02
2026-03-20 04:09	a7fdc23	2.021464	11.20	21.0	1024	discard	10 layers (too slow locally)
2026-03-20 04:48	0cb5372	2.001811	10.89	21.0	1024	discard	shorter muon momentum warmup (500->100)
2026-03-20 05:24	a361be4	1.984391	10.33	21.0	1024	keep	increase Muon WD 0.02->0.04
2026-03-20 05:59	792e088	2.001281	10.75	21.0	1024	discard	LR 0.40/0.40/0.50 (too high)
2026-03-20 06:34	ace5d28	1.979305	10.04	21.0	1024	keep	Muon WD 0.08
2026-03-20 07:09	d997454	1.970474	9.49	21.0	1024	keep	Muon WD 0.16
2026-03-20 07:43	583c6ff	1.957802	8.51	21.0	1024	keep	Muon WD 0.32
2026-03-20 08:18	c86fd10	1.962219	6.98	21.0	1024	discard	Muon WD 0.64 (quant penalty too high)
2026-03-20 08:54	e76e916	1.961715	8.77	21.0	1024	discard	FP16 embed (too small vs variance)
2026-03-20 09:29	3db9ba7	1.926774	8.46	21.0	1024	keep	add WD to embedding (Adam-optimized)
2026-03-20 11:39	876212d	1.921599	8.46	49.0	1024	keep	sliding window eval (stride=512)
2026-03-20 12:29	d1f1eca	1.949339	8.43	34.0	1024	discard	overtone spectral embedding init
2026-03-20 13:05	fd75774	1.948436	8.30	35.0	1024	discard	phase-transition residual mixing init
2026-03-20 13:43	9ddff0b	1.919193	8.30	34.0	1024	keep	WD on scalar params
2026-03-20 14:18	036ba0f	1.919436	8.28	35.0	1024	discard	higher embed LR ratio (0.50:0.30)
2026-03-20 14:55	40fa7b6	1.915771	8.30	35.0	1024	keep	reduce warmup steps 20->5
2026-03-20 15:30	21b6018	1.864865	6.66	49.0	1024	discard	reduce model dim 512->448 (M2-only win reverted)
2026-03-20 16:20	a2eae68	1.784953	5.12	44.0	1024	discard	reduce model dim 448->384 (M2-only win reverted)
2026-03-20 18:05	2cf3e71	2.259682	8.18	35.0	1024	discard	label smoothing 0.1 (0.344 worse)
2026-03-20 18:56	e02f76f	2.023655	6.35	34.0	1024	discard	Newton-Schulz 5->3 (0.108 worse)
2026-03-20 19:32	5707921	2.094785	3.52	34.0	1024	discard	int6 post-quant step=4 (quant penalty 0.173)
2026-03-20 20:08	bbe853d	1.918711	8.66	34.0	1024	discard	late-K passthrough (last 2 layers c_k fp16)
2026-03-20 20:43	680beaa	1.973369	8.21	34.0	1024	discard	fused QKV projection (0.058 worse)
2026-03-20 21:19	433b727	1.918345	8.42	34.0	1024	discard	orthogonal init (0.003 worse, within noise)
2026-03-20 21:55	0f62eff	1.914901	8.29	33.0	1024	keep	tighter grad clip 1.0->0.3
2026-03-20 22:30	e9b87cb	1.945570	10.10	38.0	1024	discard	MLP 3x expansion (fewer steps on M2)
2026-03-20 23:09	2eb51d5	1.914187	8.35	34.0	1024	keep	Muon momentum 0.95->0.99
2026-03-21 00:07	e5d3af8	2.021985	7.72	35.0	1024	discard	warmdown 1200->3000 (0.108 worse, too aggressive for M2)
2026-03-21 00:46	8c92185	1.876820	8.35	35.0	1024	keep	larger microbatch 8K->16K tokens (0.037 better)
2026-03-21 01:28	48140de	1.888455	8.38	35.0	1024	discard	microbatch 32K (0.012 worse than 16K)
2026-03-21 02:06	3421ef4	-	-	-	1024	discard	disable eager eval (3x slower on 16GB, killed)
2026-03-21 02:09	d304c0d	1.753172	8.63	32.0	1024	keep	seq_len 1024->512 (0.124 better, 224 steps)
2026-03-21 02:41	d22a195	1.803759	8.73	30.0	1024	discard	seq_len 256 (0.051 worse than 512, lost context)
2026-03-21 03:15	fa4cb62	1.753888	8.56	32.0	1024	discard	MLX-native grad clip (0.001 worse, within noise)
2026-03-21 03:47	55c6271	1.782437	8.28	32.0	1024	discard	lower LR 0.20/0.20/0.25 (0.029 worse)
2026-03-21 04:19	9715271	1.782069	8.78	32.0	1024	discard	higher LR 0.40/0.40/0.50 (0.029 worse)
2026-03-21 04:51	b5400a6	1.837271	8.60	32.0	1024	discard	warmdown 800 (0.084 worse, too aggressive)
2026-03-21 05:25	2609e95	1.718706	8.62	55.0	1024	keep	sliding window eval stride=256 (0.035 better, eval-only)
2026-03-21 06:57	f26a083	1.827255	9.20	55.0	1024	discard	WD 0.32->0.24 (0.109 worse, larger artifact)
2026-03-21 08:02	3c49fdd	1.753998	7.62	55.0	1024	discard	WD 0.32->0.48 (0.035 worse, smaller artifact)
2026-03-21 08:48	66b4be4	1.778245	8.64	82.0	1024	discard	NTK-RoPE eval extrapolation seq=1024 (0.060 worse)
2026-03-21 10:02	0fd3615	2.143158	5.83	55.0	1024	discard	cosine LR schedule (0.424 worse, LR too high early)
2026-03-21 10:48	b4b9d46	1.742123	8.48	55.0	1024	discard	7L MLP_MULT=3 (0.023 worse, 246 steps, competitive)
